[
  {"rank": 1, "word": "electro", "aliases": ["electronica"], "hint": "pending"},
  {"rank": 2, "word": "game", "aliases": ["arcade"], "hint": "pending"},
  {"rank": 3, "word": "ambient", "aliases": [], "hint": "pending"},
  {"rank": 4, "word": "cinematic", "aliases": ["trailer"], "hint": "pending"},
  {"rank": 5, "word": "dance", "aliases": [], "hint": "pending"},
  {"rank": 6, "word": "house", "aliases": [], "hint": "pending"},
  {"rank": 7, "word": "chillout", "aliases": ["lofi"], "hint": "pending"},
  {"rank": 8, "word": "pop", "aliases": [], "hint": "pending"},
  {"rank": 9, "word": "techno", "aliases": [], "hint": "pending"},
  {"rank": 10, "word": "dubstep", "aliases": [], "hint": "pending"},
  {"rank": 11, "word": "acid", "aliases": [], "hint": "pending"},
  {"rank": 12, "word": "trance", "aliases": [], "hint": "pending"},
  {"rank": 13, "word": "sci-fi", "aliases": [], "hint": "pending"},
  {"rank": 14, "word": "rave", "aliases": ["hardcore"], "hint": "pending"},
  {"rank": 15, "word": "synthwave", "aliases": ["80s"], "hint": "pending"},
  {"rank": 16, "word": "edm", "aliases": ["big room"], "hint": "pending"},
  {"rank": 17, "word": "hip-hop", "aliases": [], "hint": "pending"},
  {"rank": 18, "word": "dnb", "aliases": ["jungle"], "hint": "pending"},
  {"rank": 19, "word": "trap", "aliases": [], "hint": "pending"},
  {"rank": 20, "word": "horror", "aliases": [], "hint": "pending"},
  {"rank": 21, "word": "rock", "aliases": [], "hint": "pending"},
  {"rank": 22, "word": "reggae", "aliases": ["dub"], "hint": "pending"},
  {"rank": 23, "word": "orchestral", "aliases": [], "hint": "pending"},
  {"rank": 24, "word": "jazz", "aliases": [], "hint": "pending"},
  {"rank": 25, "word": "industrial", "aliases": [], "hint": "pending"},
  {"rank": 26, "word": "90s", "aliases": [], "hint": "pending"}
]
