[
  {"rank": 1, "word": "oscillator waveforms", "aliases": ["saw", "square", "sine", "pulse", "triangle"], "group": "oscillator waveform"},
  {"rank": 2, "word": "distortion", "aliases": ["drive"], "group": "distortion drive"},
  {"rank": 3, "word": "filter", "aliases": ["cutoff"], "group": "filter cutoff"},
  {"rank": 4, "word": "noise", "aliases": [], "group": "noise level"},
  {"rank": 5, "word": "reverb", "aliases": [], "group": "reverb"},
  {"rank": 6, "word": "lfo", "aliases": ["modulation"], "group": "lfo modulation"},
  {"rank": 7, "word": "delay", "aliases": ["echo"], "group": "delay"},
  {"rank": 8, "word": "fm", "aliases": [], "group": "frequency modulation"},
  {"rank": 9, "word": "unison", "aliases": ["detune"], "group": "unison detune"},
  {"rank": 10, "word": "envelope", "aliases": ["adsr"], "group": "envelope"},
  {"rank": 11, "word": "formant", "aliases": ["vowel"], "group": "formant filter"},
  {"rank": 12, "word": "phaser", "aliases": ["flanger"], "group": "phaser and flanger"},
  {"rank": 13, "word": "chorus", "aliases": ["ensemble"], "group": "chorus"},
  {"rank": 14, "word": "sub oscillator", "aliases": [], "group": "sub oscillator"},
  {"rank": 15, "word": "granular", "aliases": [], "group": "granular"},
  {"rank": 16, "word": "resonance", "aliases": [], "group": "filter resonance"},
  {"rank": 17, "word": "vibrato", "aliases": []},
  {"rank": 18, "word": "bitcrush", "aliases": ["downsample"]},
  {"rank": 19, "word": "glide", "aliases": ["portamento"]},
  {"rank": 20, "word": "tremolo", "aliases": []},
  {"rank": 21, "word": "sidechain", "aliases": ["pump"]},
  {"rank": 22, "word": "sync", "aliases": ["oscillator sync"]},
  {"rank": 23, "word": "wavetable", "aliases": []},
  {"rank": 24, "word": "eq", "aliases": []},
  {"rank": 25, "word": "compression", "aliases": ["multiband compression"]},
  {"rank": 26, "word": "convolution", "aliases": []}
]
